{
  "prototype_status": "PIPELINE_VALIDATED",
  "scientific_hypothesis": "NOT_ESTABLISHED",
  "scenario_count": 5,
  "profile_summary": {
    "B0": {
      "incident_accuracy": 0.4,
      "execution_attribution": 0.2,
      "authority_edge_localization": 0.4,
      "principal_chain_reconstruction": 0.0,
      "commitment_localization": 0.8,
      "revocation_localization": 0.8,
      "composite": 0.4333333333333333
    },
    "B1": {
      "incident_accuracy": 0.4,
      "execution_attribution": 1.0,
      "authority_edge_localization": 0.4,
      "principal_chain_reconstruction": 0.0,
      "commitment_localization": 0.8,
      "revocation_localization": 0.8,
      "composite": 0.5666666666666667
    },
    "B2": {
      "incident_accuracy": 0.4,
      "execution_attribution": 1.0,
      "authority_edge_localization": 0.4,
      "principal_chain_reconstruction": 1.0,
      "commitment_localization": 0.8,
      "revocation_localization": 0.8,
      "composite": 0.7333333333333333
    },
    "B3": {
      "incident_accuracy": 0.6,
      "execution_attribution": 1.0,
      "authority_edge_localization": 0.8,
      "principal_chain_reconstruction": 1.0,
      "commitment_localization": 0.8,
      "revocation_localization": 0.8,
      "composite": 0.8333333333333334
    },
    "B4": {
      "incident_accuracy": 0.8,
      "execution_attribution": 1.0,
      "authority_edge_localization": 0.8,
      "principal_chain_reconstruction": 1.0,
      "commitment_localization": 0.8,
      "revocation_localization": 0.8,
      "composite": 0.8666666666666666
    },
    "W": {
      "incident_accuracy": 1.0,
      "execution_attribution": 1.0,
      "authority_edge_localization": 1.0,
      "principal_chain_reconstruction": 1.0,
      "commitment_localization": 0.8,
      "revocation_localization": 1.0,
      "composite": 0.9666666666666666
    }
  },
  "ablation_summary": {
    "identity": {
      "composite_without": 0.8333333333333334,
      "evidence_contribution": 0.1333333333333332,
      "metric_contributions": {
        "incident_accuracy": 0.0,
        "execution_attribution": 0.8,
        "authority_edge_localization": 0.0,
        "principal_chain_reconstruction": 0.0,
        "commitment_localization": 0.0,
        "revocation_localization": 0.0
      }
    },
    "provenance": {
      "composite_without": 0.8,
      "evidence_contribution": 0.16666666666666652,
      "metric_contributions": {
        "incident_accuracy": 0.0,
        "execution_attribution": 0.0,
        "authority_edge_localization": 0.0,
        "principal_chain_reconstruction": 1.0,
        "commitment_localization": 0.0,
        "revocation_localization": 0.0
      }
    },
    "delegation_scope": {
      "composite_without": 0.8666666666666666,
      "evidence_contribution": 0.09999999999999998,
      "metric_contributions": {
        "incident_accuracy": 0.19999999999999996,
        "execution_attribution": 0.0,
        "authority_edge_localization": 0.4,
        "principal_chain_reconstruction": 0.0,
        "commitment_localization": 0.0,
        "revocation_localization": 0.0
      }
    },
    "commitment": {
      "composite_without": 0.9333333333333333,
      "evidence_contribution": 0.033333333333333215,
      "metric_contributions": {
        "incident_accuracy": 0.19999999999999996,
        "execution_attribution": 0.0,
        "authority_edge_localization": 0.0,
        "principal_chain_reconstruction": 0.0,
        "commitment_localization": 0.0,
        "revocation_localization": 0.0
      }
    },
    "revocation": {
      "composite_without": 0.8666666666666666,
      "evidence_contribution": 0.09999999999999998,
      "metric_contributions": {
        "incident_accuracy": 0.19999999999999996,
        "execution_attribution": 0.0,
        "authority_edge_localization": 0.19999999999999996,
        "principal_chain_reconstruction": 0.0,
        "commitment_localization": 0.0,
        "revocation_localization": 0.19999999999999996
      }
    },
    "outcome": {
      "composite_without": 0.9666666666666666,
      "evidence_contribution": 0.0,
      "metric_contributions": {
        "incident_accuracy": 0.0,
        "execution_attribution": 0.0,
        "authority_edge_localization": 0.0,
        "principal_chain_reconstruction": 0.0,
        "commitment_localization": 0.0,
        "revocation_localization": 0.0
      }
    }
  }
}